[
  {
    "id": "5f1b2c3d4e5f6a7b8c9d0e1f",
    "name": "Design new landing page",
    "desc": "Create wireframes and visual design for the Q3 marketing landing page refresh.",
    "closed": false,
    "idBoard": "a1b2c3d4e5f6a7b8c9d0e1f2",
    "idList": "b1c2d3e4f5a6b7c8d9e0f1a2",
    "idMembers": ["c1d2e3f4a5b6c7d8e9f0a1b2"],
    "idLabels": ["d1e2f3a4b5c6d7e8f9a0b1c2"],
    "due": "2026-05-15T17:00:00.000Z",
    "dueComplete": false,
    "pos": 16384,
    "url": "https://trello.com/c/AbCdEfGh/1-design-new-landing-page",
    "shortUrl": "https://trello.com/c/AbCdEfGh",
    "dateLastActivity": "2026-05-02T14:30:00.000Z"
  },
  {
    "id": "6a2b3c4d5e6f7a8b9c0d1e2f",
    "name": "Fix login bug on mobile",
    "desc": "Users on iOS 16 cannot log in. Investigate and patch.",
    "closed": false,
    "idBoard": "a1b2c3d4e5f6a7b8c9d0e1f2",
    "idList": "c1d2e3f4a5b6c7d8e9f0a1b2",
    "idMembers": ["e1f2a3b4c5d6e7f8a9b0c1d2"],
    "idLabels": ["f1a2b3c4d5e6f7a8b9c0d1e2"],
    "due": "2026-05-08T17:00:00.000Z",
    "dueComplete": false,
    "pos": 32768,
    "url": "https://trello.com/c/IjKlMnOp/2-fix-login-bug-on-mobile",
    "shortUrl": "https://trello.com/c/IjKlMnOp",
    "dateLastActivity": "2026-05-03T09:15:00.000Z"
  }
]
